<?xml version="1.0"?>
<GenericService xmlns:ns="http://NamespaceTest.com/NodeType"
  xmlns:xsi="http://www.w3.org/2001/XMLSchema-instance"
  xsi:noNamespaceSchemaLocation="file:/C:/Program%20Files/validmaker/Data/Schema/GenericService.xsd" name="Vlan">
  <Description />
<Priority>2</Priority>
<Domain>L2</Domain>
  <ServiceTree>
    <Node name="interface" uid="1">
      <BaseParent />
      <Children>
        <Node name="mode" uid="2">
          <BaseParent xsi:nil="true" />
        </Node>
        <Node name="vlan" uid="3">
          <BaseParent xsi:nil="true" />
        </Node>
      </Children>
    </Node>
  </ServiceTree>
</GenericService>
